{
  "schemaVersion": "1.0.0",
  "generatedAt": "2026-06-01T16:45:59.425Z",
  "revisionDir": "examples/cv-reference/revisions/revision-009",
  "icons": {
    "phone": {
      "iconSet": "mdi:phone-outline",
      "prefix": "mdi",
      "name": "phone-outline",
      "file": "assets/icons/phone.png",
      "size": 64,
      "pointSize": 9,
      "color": "#181818",
      "pickedBy": "explicit",
      "visualHint": null
    },
    "email": {
      "iconSet": "mdi:email-outline",
      "prefix": "mdi",
      "name": "email-outline",
      "file": "assets/icons/email.png",
      "size": 64,
      "pointSize": 9,
      "color": "#181818",
      "pickedBy": "explicit",
      "visualHint": null
    },
    "location": {
      "iconSet": "mdi:map-marker-outline",
      "prefix": "mdi",
      "name": "map-marker-outline",
      "file": "assets/icons/location.png",
      "size": 64,
      "pointSize": 9,
      "color": "#181818",
      "pickedBy": "explicit",
      "visualHint": null
    },
    "website": {
      "iconSet": "mdi:web",
      "prefix": "mdi",
      "name": "web",
      "file": "assets/icons/website.png",
      "size": 64,
      "pointSize": 9,
      "color": "#181818",
      "pickedBy": "explicit",
      "visualHint": null
    },
    "twitter": {
      "iconSet": "entypo-social:twitter-with-circle",
      "prefix": "entypo-social",
      "name": "twitter-with-circle",
      "file": "assets/icons/twitter.png",
      "size": 96,
      "pointSize": 13,
      "color": "#181818",
      "pickedBy": "explicit",
      "visualHint": null
    },
    "facebook": {
      "iconSet": "entypo-social:facebook-with-circle",
      "prefix": "entypo-social",
      "name": "facebook-with-circle",
      "file": "assets/icons/facebook.png",
      "size": 96,
      "pointSize": 13,
      "color": "#181818",
      "pickedBy": "explicit",
      "visualHint": null
    },
    "pinterest": {
      "iconSet": "entypo-social:pinterest-with-circle",
      "prefix": "entypo-social",
      "name": "pinterest-with-circle",
      "file": "assets/icons/pinterest.png",
      "size": 96,
      "pointSize": 13,
      "color": "#181818",
      "pickedBy": "explicit",
      "visualHint": null
    },
    "linkedin": {
      "iconSet": "entypo-social:linkedin-with-circle",
      "prefix": "entypo-social",
      "name": "linkedin-with-circle",
      "file": "assets/icons/linkedin.png",
      "size": 96,
      "pointSize": 13,
      "color": "#181818",
      "pickedBy": "explicit",
      "visualHint": null
    },
    "expertise-badge": {
      "iconSet": "mdi:check-circle-outline",
      "prefix": "mdi",
      "name": "check-circle-outline",
      "file": "assets/icons/expertise-badge.png",
      "size": 192,
      "pointSize": 38,
      "color": "#181818",
      "pickedBy": "explicit",
      "visualHint": null
    }
  },
  "fonts": {
    "heading": {
      "role": "heading",
      "family": "Poppins",
      "fontName": "POPPINS",
      "weights": [
        400,
        700
      ],
      "source": "graphcompose-bundled",
      "status": "ok",
      "registration": "default-fonts"
    },
    "body": {
      "role": "body",
      "family": "Poppins",
      "fontName": "POPPINS",
      "weights": [
        400,
        700
      ],
      "source": "graphcompose-bundled",
      "status": "ok",
      "registration": "default-fonts"
    },
    "fallback": {
      "role": "fallback",
      "family": "Helvetica",
      "fontName": "HELVETICA",
      "weights": [
        400,
        700
      ],
      "source": "standard14",
      "status": "ok",
      "registration": "standard14"
    }
  }
}
